{"id":"chat","version":"1.0.0","name":"聊天观察","description":"通过对话发现兴趣、感受与观察。","entryUrl":"http://localhost:3000/home.html?from=ai-bole","healthUrl":"http://localhost:3000/chat.html","targetAge":{"min":4,"max":18},"constructRegistryVersion":"1.0","constructs":["self_reflection.interest_expression","collaboration.perspective_taking"],"supportedEventTypes":["chat.observation-shared.v1"],"capabilities":{"resumable":true,"producesArtifacts":true,"requiresAI":true,"supportsOfflineEvidence":true}}
