{"id":"career","version":"1.0.0","name":"职业模拟器","description":"体验不同职业的一天和真实任务。","entryUrl":"http://localhost:8000/?from=ai-bole","healthUrl":"http://localhost:8000","targetAge":{"min":6,"max":18},"constructRegistryVersion":"1.0","constructs":["problem_solving.planning","problem_solving.adaptation"],"supportedEventTypes":["career.task-completed.v1"],"capabilities":{"resumable":true,"producesArtifacts":true,"requiresAI":false,"supportsOfflineEvidence":true}}
