{"id":"deep_sea","version":"1.0.0","name":"深海基地重建","description":"规划空间、调配资源并完成建造挑战。","entryUrl":"http://localhost:3001/?from=ai-bole","healthUrl":"http://localhost:8005/api/health","targetAge":{"min":4,"max":18},"constructRegistryVersion":"1.0","constructs":["spatial.solution_design","problem_solving.planning"],"supportedEventTypes":["deep-sea.spatial-task-completed.v1","deep-sea.session-completed.v1"],"capabilities":{"resumable":true,"producesArtifacts":true,"requiresAI":true,"supportsOfflineEvidence":true}}
