{"id":"story","version":"1.0.0","name":"故事共创","description":"创造人物、情节和自己的想象世界。","entryUrl":"http://localhost:5174/story-create?from=ai-bole","healthUrl":"http://localhost:8010/api/health","targetAge":{"min":4,"max":18},"constructRegistryVersion":"1.0","constructs":["creativity.narrative_expression"],"supportedEventTypes":["story.contribution-completed.v1"],"capabilities":{"resumable":true,"producesArtifacts":true,"requiresAI":true,"supportsOfflineEvidence":true}}
